Сделать парсинг с rusprofile.ru. Результат в excel,2000,https://kwork.ru/projects/1341550
Исправить ошибку парсера,до500,https://kwork.ru/projects/1341520
PHP парсер,3000,https://kwork.ru/projects/1341335
Парсинг и инвайт подписчиков на канал телеги,до500,https://kwork.ru/projects/1341325
Спарсить верстку сайта,до500,https://kwork.ru/projects/1341124
Спарсить сайт,до500,https://kwork.ru/projects/1340998
Спарсить товары и настроить фильтр на битриксе,1000,https://kwork.ru/projects/1340896
Написать парсер для блокчейн игры,1000,https://kwork.ru/projects/1340780
Парсинг данных,1000,https://kwork.ru/projects/1340391
Скрипт для мониторинга отзывов на вб и озон парсер,3000,https://kwork.ru/projects/1340271
Парсинг товаров и брендов на маркетплейсах,50000,https://kwork.ru/projects/1340025
Парсинг сайтов с выводом данных в Discord через бота,7000,https://kwork.ru/projects/1339727
Улучшить сервис парсинга заказов в приложении на андройд,15000,https://kwork.ru/projects/1339648
Сайт каталог с парсером из авито,30000,https://kwork.ru/projects/1339179
Парсинг Yelp,25000,https://kwork.ru/projects/1338058
Спарсить определенный Инстаграм аккаунт в wordpress,2500,https://kwork.ru/projects/1309863
